{
  "$schema": "https://json-schema.org/draft/2020-12/schema",
  "$id": "https://auralgeometrylab.local/schemas/agl-command-v2.schema.json",
  "title": "Aural Geometry Lab Semantic Command v2",
  "type": "object",
  "additionalProperties": false,
  "required": [
    "schema",
    "schemaVersion",
    "contractVersion",
    "commandId",
    "transactionId",
    "logicalActionId",
    "projectId",
    "projectEpoch",
    "baseRevision",
    "actor",
    "origin",
    "kind",
    "payloadVersion",
    "payload",
    "targetSet",
    "writeSet",
    "preconditions"
  ],
  "properties": {
    "schema": {
      "const": "agl.command"
    },
    "schemaVersion": {
      "const": 2
    },
    "contractVersion": {
      "const": "agl-command-contract-v2"
    },
    "commandId": {
      "$ref": "#/$defs/id"
    },
    "transactionId": {
      "$ref": "#/$defs/id"
    },
    "logicalActionId": {
      "$ref": "#/$defs/id"
    },
    "editSessionId": {
      "$ref": "#/$defs/id"
    },
    "projectId": {
      "$ref": "#/$defs/id"
    },
    "projectEpoch": {
      "$ref": "#/$defs/id"
    },
    "baseRevision": {
      "$ref": "#/$defs/uint"
    },
    "actor": {
      "type": "object",
      "additionalProperties": false,
      "required": [
        "actorId",
        "sequence"
      ],
      "properties": {
        "actorId": {
          "$ref": "#/$defs/id"
        },
        "sequence": {
          "$ref": "#/$defs/uint"
        }
      }
    },
    "origin": {
      "enum": [
        "user",
        "undo",
        "redo",
        "migration",
        "system"
      ]
    },
    "kind": {
      "type": "string",
      "pattern": "^[A-Z][A-Za-z0-9.:-]{0,127}$"
    },
    "payloadVersion": {
      "type": "integer",
      "minimum": 1,
      "maximum": 9007199254740991
    },
    "payload": {},
    "targetSet": {
      "$ref": "#/$defs/idSet"
    },
    "writeSet": {
      "$ref": "#/$defs/fieldPathSet"
    },
    "preconditions": {
      "type": "array",
      "maxItems": 10000,
      "items": {
        "$ref": "#/$defs/precondition"
      }
    },
    "lineage": {
      "type": "object",
      "additionalProperties": false,
      "properties": {
        "causedByCommandId": {
          "$ref": "#/$defs/id"
        },
        "migratedFromCommandId": {
          "$ref": "#/$defs/id"
        }
      }
    },
    "issuedAt": {
      "type": "string",
      "format": "date-time",
      "pattern": "^\\d{4}-\\d{2}-\\d{2}T\\d{2}:\\d{2}:\\d{2}\\.\\d{3}Z$"
    }
  },
  "$defs": {
    "id": {
      "type": "string",
      "minLength": 1,
      "maxLength": 256,
      "pattern": "^[A-Za-z0-9][A-Za-z0-9._:~\\/-]{0,255}$"
    },
    "uint": {
      "type": "string",
      "pattern": "^(0|[1-9][0-9]*)$",
      "maxLength": 4096
    },
    "digest": {
      "type": "string",
      "pattern": "^sha256:[a-f0-9]{64}$"
    },
    "idSet": {
      "type": "array",
      "maxItems": 10000,
      "uniqueItems": true,
      "items": {
        "$ref": "#/$defs/id"
      }
    },
    "precondition": {
      "oneOf": [
        {
          "type": "object",
          "additionalProperties": false,
          "required": [
            "kind",
            "entityId"
          ],
          "properties": {
            "kind": {
              "enum": [
                "entity-exists",
                "entity-absent"
              ]
            },
            "entityId": {
              "$ref": "#/$defs/id"
            }
          }
        },
        {
          "type": "object",
          "additionalProperties": false,
          "required": [
            "kind",
            "entityId",
            "fieldPathId",
            "expectedDigest"
          ],
          "properties": {
            "kind": {
              "const": "field-digest-equals"
            },
            "entityId": {
              "$ref": "#/$defs/id"
            },
            "fieldPathId": {
              "$ref": "#/$defs/fieldPathId"
            },
            "expectedDigest": {
              "$ref": "#/$defs/digest"
            }
          }
        },
        {
          "type": "object",
          "additionalProperties": false,
          "required": [
            "kind",
            "targetId",
            "expectedDigest"
          ],
          "properties": {
            "kind": {
              "const": "input-digest-equals"
            },
            "targetId": {
              "$ref": "#/$defs/id"
            },
            "expectedDigest": {
              "$ref": "#/$defs/digest"
            }
          }
        }
      ]
    },
    "fieldPath": {
      "type": "string",
      "pattern": "^[a-z0-9]+(?:[.-][a-z0-9]+)*@v[1-9][0-9]*$"
    },
    "fieldPathSet": {
      "type": "array",
      "minItems": 1,
      "maxItems": 10000,
      "uniqueItems": true,
      "items": {
        "$ref": "#/$defs/fieldPathId"
      }
    },
    "canonicalUtc": {
      "type": "string",
      "pattern": "^[0-9]{4}-[0-9]{2}-[0-9]{2}T[0-9]{2}:[0-9]{2}:[0-9]{2}\\.[0-9]{3}Z$"
    },
    "fieldPathId": {
      "type": "string",
      "minLength": 4,
      "maxLength": 256,
      "pattern": "^[a-z0-9]+(?:[.-][a-z0-9]+)*@v[1-9][0-9]*$"
    }
  }
}
